Question,Response
What is the role of international regulatory coordination in ensuring the Shariah compliance of cross-border cryptocurrency transactions?,"International regulatory coordination plays a crucial role in ensuring the Shariah compliance of cross-border cryptocurrency transactions by harmonizing regulatory standards, enhancing legal certainty, and facilitating the ethical use of cryptocurrencies in accordance with Islamic finance principles. Here's how:

1. **Harmonization of Regulatory Standards**: International coordination helps in establishing a common set of regulatory standards for cryptocurrencies that can be adopted across different jurisdictions. This harmonization is crucial for Shariah compliance, as it reduces the complexity and inconsistency of regulations that Islamic financial institutions and Muslim investors face when engaging in cross-border transactions. Consistent standards ensure that Shariah-compliant crypto transactions remain compliant across borders.

2. **Enhanced Legal Certainty and Compliance**: Coordinated regulatory frameworks provide clearer guidelines on the legality and compliance requirements of cryptocurrency transactions. This legal certainty is important for ensuring that cross-border crypto transactions adhere to both Shariah principles and local laws, minimizing the risk of engaging in transactions that could be considered non-compliant in certain jurisdictions.

3. **Facilitation of Shariah-Compliant Cross-Border Transactions**: By aligning regulatory approaches, international coordination facilitates smoother and more efficient cross-border cryptocurrency transactions that comply with Shariah principles. This includes ensuring that transactions do not involve prohibited activities such as Riba (interest), Gharar (excessive uncertainty), and Maysir (gambling), and that they are conducted in a transparent and ethical manner.

4. **Prevention of Financial Crimes**: Coordinated efforts in regulating cryptocurrencies help in the effective implementation of anti-money laundering (AML) and counter-financing of terrorism (CFT) measures. These efforts are aligned with Shariah principles, which strictly prohibit activities that harm society. International regulatory coordination ensures that cryptocurrencies are not used for illicit purposes, enhancing the Shariah compliance of cross-border transactions.

5. **Promotion of Financial Inclusion and Ethical Finance**: International regulatory coordination can promote financial inclusion and the development of ethical finance solutions that align with Islamic finance principles. By providing a supportive regulatory environment, cross-border cryptocurrency transactions can contribute to economic empowerment and the development of Shariah-compliant financial services that benefit underserved populations.

6. **Collaboration on Shariah Governance**: Coordination among international regulators can also extend to Shariah governance, where shared guidelines and best practices for the Shariah compliance of cryptocurrencies are developed. This collaborative approach can help standardize the Shariah compliance assessment of cryptocurrencies, ensuring consistency and reliability in cross-border transactions.

In summary, international regulatory coordination is essential for ensuring the Shariah compliance of cross-border cryptocurrency transactions. It helps harmonize regulatory standards, enhances legal and Shariah compliance, facilitates ethical and transparent transactions, prevents financial crimes, promotes financial inclusion, and supports the development of a global framework for Shariah governance in the cryptocurrency sector."
